[
  {
    "id": "RL-20260506-001",
    "title": "Test filename suffixes carry meaning: .spec.ts for unit-style specs, .integration.spec.ts for...",
    "sourceWindowId": "CLOSED-20260129-20260205",
    "prNumbers": [
      2886,
      2884
    ],
    "prState": "merged",
    "reviewCommentIds": [
      2742620457,
      2742720670
    ],
    "reviewIds": [
      3723406538
    ],
    "issueCommentIds": [],
    "learning": "Test filename suffixes carry meaning: `*.spec.ts` for unit-style specs, `*.integration.spec.ts` for integration specs that boot Nest modules or hit a DB. Match the suffix to the test layer rather than to existing siblings.",
    "ruleIds": [
      "NAME-01",
      "TEST-02"
    ]
  },
  {
    "id": "RL-20260506-002",
    "title": "When the same shaped object is constructed in more than one test with small field overrides,...",
    "sourceWindowId": "CLOSED-20260129-20260205",
    "prNumbers": [
      2884,
      2883
    ],
    "prState": "merged",
    "reviewCommentIds": [
      2736467627,
      2736470098,
      2741044502,
      2742007765,
      2742011818,
      2742041552
    ],
    "reviewIds": [],
    "issueCommentIds": [],
    "learning": "When the same shaped object is constructed in more than one test with small field overrides, introduce a builder rather than copy-pasting literals. The repo's `Builder<T>.with(field, value)` pattern is the default for entity-like fixtures.",
    "ruleIds": [
      "TEST-01"
    ]
  },
  {
    "id": "RL-20260506-003",
    "title": "Before hardcoding a knob (limit, page cap, threshold), search the repo for the same concern i...",
    "sourceWindowId": "CLOSED-20260129-20260205",
    "prNumbers": [
      2883
    ],
    "prState": "merged",
    "reviewCommentIds": [
      2728482403,
      2735846566
    ],
    "reviewIds": [],
    "issueCommentIds": [
      3806400197
    ],
    "learning": "Before hardcoding a knob (limit, page cap, threshold), search the repo for the same concern in another repository/manager. If a precedent exists (ChainsRepository, ContractsRepository), follow the configuration-driven pattern instead of introducing a hardcoded copy.",
    "ruleIds": [
      "CONFIG-03",
      "REUSE-01"
    ]
  },
  {
    "id": "RL-20260506-004",
    "title": "When adding a required field to the configuration schema, update every invalidConfiguration t...",
    "sourceWindowId": "CLOSED-20260129-20260205",
    "prNumbers": [
      2873
    ],
    "prState": "merged",
    "reviewCommentIds": [
      2705249006
    ],
    "reviewIds": [],
    "issueCommentIds": [],
    "learning": "When adding a required field to the configuration schema, update every `invalidConfiguration` test fixture used by other tests, not only `validConfiguration`. Otherwise tests asserting on unrelated invalid fields start failing on the new field instead of the intended one.",
    "ruleIds": [
      "CONFIG-02",
      "TEST-04"
    ]
  },
  {
    "id": "RL-20260506-005",
    "title": "Destructuring with the same name as an outer let variable shadows it.",
    "sourceWindowId": "CLOSED-20260129-20260205",
    "prNumbers": [
      2883
    ],
    "prState": "merged",
    "reviewCommentIds": [
      2737760960,
      2740775660
    ],
    "reviewIds": [],
    "issueCommentIds": [],
    "learning": "Destructuring with the same name as an outer `let` variable shadows it. `let next = null; const { next, results } = parsed` keeps the outer `next` at `null`. Either rename in the destructure (`const { next: nextUrl, ... }`) or reassign explicitly to the outer variable.",
    "ruleIds": [
      "STYLE-01",
      "TYPE-06"
    ]
  },
  {
    "id": "RL-20260506-006",
    "title": "When paginating large objects but only one field flows downstream, extract that field per pag...",
    "sourceWindowId": "CLOSED-20260129-20260205",
    "prNumbers": [
      2883
    ],
    "prState": "merged",
    "reviewCommentIds": [
      2735843106,
      2741041264
    ],
    "reviewIds": [],
    "issueCommentIds": [],
    "learning": "When paginating large objects but only one field flows downstream, extract that field per page (push addresses, not whole `SafeV2`s) rather than accumulating full objects in memory across pages.",
    "ruleIds": [
      "PERF-01"
    ]
  },
  {
    "id": "RL-20260506-007",
    "title": "Migration runners must not use the recorded last migration id as an array index.",
    "sourceWindowId": "CLOSED-20260129-20260205",
    "prNumbers": [
      2804
    ],
    "prState": "merged",
    "reviewCommentIds": [],
    "reviewIds": [
      3549324887,
      3549325995
    ],
    "issueCommentIds": [],
    "learning": "Migration runners must not use the recorded last migration `id` as an array index. Once migrations get deleted and IDs become non-contiguous, `migrations.slice(lastId)` returns the wrong slice. Filter by `migration.id > lastId` instead, and add an integration test for the gap case.",
    "ruleIds": [
      "DB-05"
    ]
  },
  {
    "id": "RL-20260128-001",
    "title": "Expiry-only caches need code comments",
    "sourceWindowId": "CLOSED-20260122-20260129",
    "prNumbers": [
      2882
    ],
    "prState": "merged",
    "reviewCommentIds": [
      2728130628,
      2728143160
    ],
    "reviewIds": [],
    "issueCommentIds": [],
    "learning": "Datasource methods with no invalidation hook should document that cached data lives until the configured expiration, so future maintainers do not assume active invalidation exists.",
    "ruleIds": [
      "CACHE-03",
      "STYLE-01"
    ]
  },
  {
    "id": "RL-20260128-002",
    "title": "Architecture docs must allow real module exceptions",
    "sourceWindowId": "CLOSED-20260122-20260129",
    "prNumbers": [
      2881
    ],
    "prState": "closed",
    "reviewCommentIds": [
      2726990802,
      2726994863,
      2726998145,
      2727039119
    ],
    "reviewIds": [
      3705348497
    ],
    "issueCommentIds": [],
    "learning": "Architecture/spec docs should describe the module shapes that actually exist, including versioned or optional folders, instead of enforcing a single strict tree that several features do not follow.",
    "ruleIds": [
      "PR-02",
      "MOD-01"
    ]
  },
  {
    "id": "RL-20260123-001",
    "title": "Normalize cached external payloads exactly once",
    "sourceWindowId": "CLOSED-20260122-20260129",
    "prNumbers": [
      2864
    ],
    "prState": "merged",
    "reviewCommentIds": [
      2683454504,
      2683488076
    ],
    "reviewIds": [],
    "issueCommentIds": [
      3739945491
    ],
    "learning": "When external payloads are normalized before caching, cache-hit code must not normalize them again; tests should cover cache-hit and cache-miss paths for transformations with signs or other non-idempotent changes.",
    "ruleIds": [
      "CACHE-03",
      "TEST-07",
      "TEST-09"
    ]
  },
  {
    "id": "RL-20260123-002",
    "title": "Internal boolean query params should be strict",
    "sourceWindowId": "CLOSED-20260122-20260129",
    "prNumbers": [
      2812
    ],
    "prState": "merged",
    "reviewCommentIds": [
      2721207920,
      2721413585
    ],
    "reviewIds": [],
    "issueCommentIds": [],
    "learning": "Internal API boolean query params should validate explicit `true`/`false` strings and default intentionally instead of accepting arbitrary strings and transforming every non-true value to false.",
    "ruleIds": [
      "ROUTE-02",
      "TYPE-02"
    ]
  },
  {
    "id": "RL-20260116-001",
    "title": "Migration metadata should preserve ownership semantics",
    "sourceWindowId": "CLOSED-20260115-20260122",
    "prNumbers": [
      2870
    ],
    "prState": "merged",
    "reviewCommentIds": [
      2695264837
    ],
    "reviewIds": [],
    "issueCommentIds": [],
    "learning": "Campaign and data migrations should preserve ownership/reporting metadata from the existing campaign unless the ownership change is intentional and documented; copy-pasted template fields need review.",
    "ruleIds": [
      "DB-05",
      "PR-02"
    ]
  },
  {
    "id": "RL-20260121-001",
    "title": "Cache format changes need versioning or invalidation",
    "sourceWindowId": "CLOSED-20260115-20260122",
    "prNumbers": [
      2863,
      2869
    ],
    "prState": "merged",
    "reviewCommentIds": [
      2690891868,
      2690910432,
      2690923158,
      2690917832,
      2690960629
    ],
    "reviewIds": [],
    "issueCommentIds": [],
    "learning": "Changing a cache payload format under the same key can crash or misroute cache-hit callers after deploy; version or invalidate the key, and do not silently return plausible empty data when cold-cache fetches fail.",
    "ruleIds": [
      "CACHE-02",
      "CACHE-03",
      "LOG-01",
      "TEST-07"
    ]
  },
  {
    "id": "RL-20260116-002",
    "title": "Empty external error strings should normalize to absence",
    "sourceWindowId": "CLOSED-20260115-20260122",
    "prNumbers": [
      2866
    ],
    "prState": "merged",
    "reviewCommentIds": [
      2694636816,
      2698535543,
      2698616002,
      2698944295
    ],
    "reviewIds": [],
    "issueCommentIds": [],
    "learning": "When mapping optional external error strings, treat empty strings as absent if they carry no user-facing information, and keep the return type honest by returning `undefined` instead of an empty message.",
    "ruleIds": [
      "TYPE-02",
      "TYPE-03"
    ]
  },
  {
    "id": "RL-20260114-001",
    "title": "Cache router fields should match service ownership",
    "sourceWindowId": "CLOSED-20260108-20260115",
    "prNumbers": [
      2863
    ],
    "prState": "merged",
    "reviewCommentIds": [
      2685383866,
      2685533588
    ],
    "reviewIds": [],
    "issueCommentIds": [],
    "learning": "Cache router helpers should not set misleading default fields when a service owns multiple hash fields; either pass the field explicitly or leave field selection to the service.",
    "ruleIds": [
      "CACHE-02",